Job_Role,Skills,Education
DIGITAL-MEDIA,"InDesign, Quark XPress, Acrobat, Photoshop, Illustrator, Freehand, Pagemaker, Microsoft Word, Publisher, Excel, Power Point, Pitstop, Quite, a Box of Tricks, Fetch and Asura., Experience, 11/2013, to, Current, implementation consultant, Company Name, Certified trainer in Salesforce Marketing Cloud, experienced in training external client teams on various components of Salesforce, Marketing Cloud, either virtually or in person., Knowledgeable in Salesforce Marketing Cloud components including Email Studio, Marketing Cloud Connect integration, MobileConnect,, Journey Builder, Contact Builder and Advertising and Social Studio., Familiar with Salesforce.com basics., Familiar with coding SQL to write queries for Salesforce Marketing Cloud solutions., documentation Experienced in writing requirements documentation and crafting technical solutions and designing flow diagrams for clients to, achieve their email marketing campaign requirements utilizing Microsoft Word, Visio and Excel., Keeps record of project requirement changes by updating the requirements documentation throughout the project., Provides test plans to the client for UAT to assist them in testing the configured solution., English major who enjoys writing in any form., Leadership Leads client calls to effectively keep projects moving forward while minimizing scope creep and managing client expectations,, and keeping the client team focused on the current SOW., software implementations and web technologies/technical abilities Aptitude for software trouble shooting, Experienced in web technologies, and coding HTML, CSS and SQL Familiar with WordPress and Dot Net Nuke frameworks Familiarity with relational data and data, management Consults with new and existing clients to implement solutions and perform initial configurations for their Salesforce Marketing, Cloud or Adobe Campaign email software and campaign solutions, with specialization in Salesforce Marketing Cloud., Leads consultative engagements which include discovery calls and solution walk throughs with the client's marketing focused business teams, to define, implement or review the configuration of their technical and business-related communication needs., Crafts project documentation which details the client's unique business requirements and email software solution configurations, which, include data segmentation and various automations aimed at automating and creating complex client configuration solutions., Provides quality assurance via solution testing and the creation and execution of configuration test plans., Provides client support during go live phase of the project, and performs ongoing support based on SOW requirements., As a certified trainer in Salesforce Marketing Cloud, conducts virtual or onsite training for clients on the email platform or various, applications within the Salesforce Marketing Cloud platform., Experienced with various applications and integrations in SFMC, including Email Studio, Marketing Cloud Connect, Journey Builder,, Contact Builder, Salesforce.com, and Advertising and Social Studio., Identifies project risks and issues and presents alternatives to the internal team or the client team to alleviate or resolve them., digital media program manager |, indico | july 2012 to november 2013., Promoted to Digital Media Program Manager for Indico, where I planned, executed, and finalized projects according to strict deadlines and, within budget for NACS Media Solutions and its subsequent name change of indiCo., This included coordinating resources such as team members and third-party contractors or consultants in order to deliver programs, according to plan for the Print on Demand network., Assisted in finalizing contracts and negotiated project deliverables and timelines with stakeholders and vendors., Responsible for defining project objectives, success metrics, and overseeing quality control throughout each project's life cycle with the goal, of creating a sustainable profitable business model., Managed the Grow Custom initiative and co-created a marketing, messaging and sponsorship package for the initiative., Contributed to the writing, layout, and content of the Guide to Custom, the Grow Custom initiative's informational piece, which has sold, more than 2,000 copies to NACS members., Sold sponsorships, ads and advertorials to vendors and publishers, and worked with sponsors to ensure that content and ads were received, by deadline and transmitted to creative personnel in a timely manner to facilitate creation of the digital and print pieces., Coordinated and performed some technical processes required for implementation related to the ingestion, testing, format revision,, distribution and output of print-on-demand and digital files contributed to the NMS and indiCo network, and contributed to development of, the digital and print-on-demand interface tools that support file access and distribution., Created content around the Print on Demand and Grow Custom initiatives on the NACS Media Solutions website and Facebook site, and, maintained the NACS Media Solutions company website using Dot Net Nuke., Updated and maintained other company websites for various NACS divisions using HTML, CSS and Dot Net Nuke., 01/2011, to, 06/2012, digital media specialist |, nacs media solutions, Managed the Print on Demand project and implemented the technical processes related to print-on-demand and digital files for NACSManaged the Print on Demand project and implemented the technical processes related to print-on-demand and digital files for NACS, Media Solutions., Contributed to the development of the digital and print-on-demand interface tools, workflows and processes that support file access and, distribution., Preflighted and corrected book files to ensure optimal print quality., Worked with outside vendors to build a print on demand network for NACS Media Solutions, supplied requirements for the network and, worked with vendors from contract phase to completion to create a viable Print on Demand (POD) network., Received a promotion in June of 2012., digital support specialist |, the plain dealer |., 01/1998, to, 12/2008, Responsible for processing, preflighting, color correcting, image enhancing and ensuring that sizes, colors, images and content of, advertisements sent into the Digital Department via outside customers and agencies printed correctly., Ensured that final reproduction of advertisements was optimal and that everything in the ad displayed as the customer intended., Worked well in a high-pressure, fast-paced environment with daily deadlines., Solely responsible for processing and file transmission of various commercial inserts, gang prints, spadeas, Comics and other direct mail, pieces to various printers., Education and Training, 2010, Completed coursework for certifications in Web Design/Development: Web Design/Development,, Polaris online - http://www.polaris.com, *Studied web design and HTML, CSS, and SQL, 1992, Bachelor of Arts, :, English, The University of Akron, ï¼​, City, ,, State, English, 1992, Bachelor of Arts, :, Political Science, The University of Akron, ï¼​, City, ,, State, Political Science, Interests, March 31, 2016 to present - License 5672023 *Salesforce Marketing Cloud Consultant Certification, *July 18, 2017 to present - License, 17482983 *Salesforce certification verification site:, http://certification.salesforce.com/verification?&fullname=Veronica%20Gancov *Studying for, PMP certification, Skills, Dot Net, Acrobat, Adobe, go live, Photoshop, ad, advertisements, ads, Advertising, Pagemaker, book, budget, color, com, concise, content,, contracts, CSS, client, clients, client relations, customer service skills, client support, data management, designing, desktop publishing, direct mail,, documentation, Email, English, fast, Fetch, Freehand, HTML, http, Illustrator, image, InDesign, layout, Leadership, managing, marketing,, messaging, access, Excel, Power Point, Publisher, Microsoft Word, Works, network, NMS, personnel, presenting, various printers, processes,, coding, project management, promotion, quality, quality assurance, quality control, Quark XPress, requirement, SQL, trainer, transmission, trouble, shooting, troubleshooting, unique, Visio, web design, Web Design/Development, website, websites, Additional Information, March 31, 2016 to present - License 5672023 *Salesforce Marketing Cloud Consultant Certification, *July 18, 2017 to present - License, 17482983 *Salesforce certification verification site:, http://certification.salesforce.com/verification?&fullname=Veronica%20Gancov",and Training
APPAREL,"Organized, Detailed, Problem Solver, Creative, Proficient in Adobe CS5, Flex PLM, Excel, Collaborative, Innovative, Driven, Efficient, Powerpoint, MS Office, Work History, Apparel Developer Specialized, Jan 2014, -, Current, Company Name, City, ,, State, Establish new fast track business model for JR fashion business across all product categories in the juniors market., Work with cross functional leadership to establish new source needs., Set up and onboard new suppliers as needed with Nordstrom product requirements., Create tools to gain speed in development process while also maintaining critical product testing and Nordstrom requirements., Lead weekly status meetings with upper management to overview process, tracking, potential concerns to ensure speed project was, successful Step in to support technical woven development projects covering outerwear, denim, soft dressing., Guided team on new approaches of working including costing tools, streamlining meetings and optimizing new systems already set in place., Work with vendors when any issues arise as needed to steer projects back on course., Sourcing areas include United States, China, India, Nicaragua and Columbia., Manager Development Apparel, Jan 2006, -, Jan 2014, Company Name, City, ,, State, Manager Apparel Development Technical apparel developer snowboarding outerwear, base layers, women's swim, board shorts, denim,, woven shirts, t-shirts and sweatshirts, graphics, printing, knits, technical performance basketball, track jackets, women's fashion knits tops, and bottoms, fashion original garments., Build tech packs and communicate daily with factories to execute technical product assortments., Collaborate with design and marketing up front to provide up front costing analysis in design phase to ensure product is right first time and, eliminate added sample rounds and improve delivery time to customers.Â, Reduced labor rates on product by 10% increasing profitÂ, Update workmanship sketches, material call outs and technical images in illustrator format on tech packs to the factoryÂ, Visit factories to conduct workshops to improve process and reduce steps to improve development time for better response to promo, needs.Â, Innovate on process where not set to create standard operation process for wider audience to reference and allow category growth as, needed for promo business unit expansion.Â, Work with athletes on wear testing trials to gain information for product improvements.Â, Coordinate and manage fit sessions with all necessary cross functions to review styles and execute needs., Directly work with suppliers and manufacturers to gain in depth technical knowledge and utilize information as needed on developments Â, Lead costing, improvements and technical quality standards to ensure all end results are capturedÂ, Provide input from development for calendar set up on a new business unit with business solutions along with representation from marketing,, design, materials, planning, costing quality, and sourcing to make sure timelines were accurate so buy ready would be met and it did!Â, Selected to work on multiple high profile short timeline projects with limited process and guidance to delivery excellent results including, Olympics, All Star, Jeremy ScottÂ, Conduct weekly cross functional meetings to allow for better communication and share information with cross functions on updates that, pertain to the greater teamÂ, Mentor new team members by implementing a new business unit manual and teaching development tasksÂ, Test product at multiple stages in development and communicate results with marketing to show potential risks and suggestions to alleviate, risk for productionÂ, Team focused and always willing to take on extra tasks as needed, Sourcing and work in the following regions Thailand, China, Indonesia, Turkey, US, India, Bangladesh, Nicaragua., Product Developer Production Assistant, Jan 2003, -, Jan 2005, Company Name, City, ,, State, Plan and purchase blanks and finished goods for private label needs., Update and track OTB reporting to ensure all product needs are met for store needs to meet sales requirements., Work with sourcing agents to develop new board shorts, prints, fleece, polo's, t- shirts, woven shirts and woven shorts Send out tech packsincluding specs, color standards, material needs, graphics and all product needs Manage fit sessions from first prototype on sample size, extended to size sets and document final graded specs for factory and production documents Conduct all quality testing needs in, development from color tests, wash testing and wear testing where needed Work with Screen-printing and embroidery technicians to ensure, blank product passes embellishment testing needs Set up concept surf shop on Maui., Buying from selected surf brands covering jr., men's, women's, accessories, surfboards and skateboards., Selected from stock blank suppliers to produce private label program and ensure margins were met Sku volume buyer 700 est., volume 25 million annually., Consultant, Jan 2003, Company Name, City, ,, State, Work with local shop owner of Roxy store to improve assortment and set up OTB program., Review floor set up and improve merchandising., Set up immediate buy strategy to improve stock deficiencies and work to reduce assortment on slow sellers to improve turn time., ., Men's Surf Buyer and Product Developer, Jan 1999, -, Jan 2003, Company Name, City, ,, State, Buyer, Product Apparel Men's Surf Track and maintain stock to sales, gross margin reporting, location sales for 7 retail stores Exceed sales, each month Manage slow selling merchandise through sell backs, discounts, merchandise transfers and exit strategies while maintaining, margin requirements., Merchandise stores each week with store visits Buy from vendors keeping assortment fresh and in demand to maintain sales each month,, vendor selection included Quiksilver, Billabong, Hurley, Volcom, Ripcurl, Lost, Split and selected local surf brands Set up monthly, promotions to drive business with partnership from brands to provide incentive to customers while driving up selected brands monthly buy, Plan OTB seasonally as well as manage chase orders Attend trade shows for action sports Establish and build good vendor relationships, Sku volume buyer 700 est., volume 1.5 million annually Develop private label board shorts, cargo shorts, aloha shirts with sourcing agents Work with surfers to develop, ultimate board shorts including testing materials, seam placements, fit and thread and stitches Shop marketplace to research trends and spot, opportunity to grow business Work closely with store managers to watch stock to sales by region and have quick reactions to store need, transfers as well as visit stores to maximize merchandising potentials., Buyer, Jan 1997, -, Jan 1999, Company Name, City, ,, State, Business planning for Home dÃ©cor department Â· Merchandise seasonal Christmas floor set up for 11 stores, communicate to all stores, weekly Â· Observe sales weekly to see where items need replenishment and flag slow sellers that need help in moving goods., Attend trade shows for home goods to review and work with suppliers on best assortment and opportunities to gain margin through, incentive programs Â· Work with store managers to learn about store needs and areas to improve Â· Determine advertising stories, and, plan volumes for upcoming advertisements Â· Enter markdowns, maintain reporting needs Â· Sku volume buyer 1000 est., volume 5 million annually., Assistant Buyer, Jan 1996, -, Jan 1997, Company Name, City, ,, State, Clerical to buying departments Update reporting for buyers of women's, coats, cosmetics Work on claims for vendors on returned, merchandise Visit stores Merchandise floors to improve sale opportunities based off reporting's Sku volume buyer 1600 (covering women's, apparel, cosmetics) 7 million annually., Education, Bachelor of Arts, :, Sociology, 1996, University of Oregon, City, Skills, adobe, advertisements, advertising, Business planning, business solutions, Clerical, color, concept, delivery, driving, fashion, fast, functional,, graphics, Illustrator, leadership, marketing, market, materials, meetings, Mentor, merchandising, excel, word, developer, paint, PLM, profit,, quality, quick, reporting, research, retail, RMS, selling, sales, stories, strategy, teaching, tops, trade shows, workshops, Additional Information",Bachelor of Arts
CONSULTANT,"PROFESSIONAL SUMMARY, Experienced, results oriented Customer Service Supervisor with a proven record of achieving business goals and objectives. Adept at, communicating with all levels of management, sales, and internal departments to coordinate overall customer experience efforts., Demonstrate success implementing and executing key projects., Leadership (14 years), Process Improvement, Proven Project Management Skills (1 year), Strategic Account Planning, Manage Cross Functional Teams, Strong Analytical Skills, Customer Experience/Retention, Excellent Negotiation Skills, Experience, Consultant Account, 12/2014, to, Current, Company Name, Responsible for strategic and tactical execution of project management initiatives that support the account management workgroup., Define project scope, goals and deliverables that support business goals in collaboration with leadership and key stakeholders., Drive online portal utilization strategies and approaches to increase business automation., Launched a Core Team to the promote business automation - up 20 points (Q1 44% - Q2 64%) Drive and evaluate best practices and, determine approaches for customer relationships., Driving record breaking results for Customer Loyalty Index (South #1 at 9.73%) and a record breaking survey score for the South's Net, Promoter Score of 83% Drive and evaluate ways to minimize churn, to protect Verizon's customer base Audit and Certify action plan, initiative that will drive the desired results Collaborate with field partners to drive opportunities and penetration into VES accounts, Proactively conduct analysis to identify root causes and data trends across key account management metrics., Verizon Business & Government Customer Operations Supervisor Account Management (Global Enterprise Advisors., 09/2013, to, 12/2014, Company Name, City, ,, State, Define, develop and implement strategic account plans encompassing AR reduction, business automation utilization, monthly audits and, proactive servicing., Led Self-Serve Execution team for the South Area (Initiative) Communicate with customers, management and internal departments to, coordinate account projects as outlined in strategic account plan., Delivered strong engagement at the account level and was able to overcome substantial opportunities with inherited relationships;, 88%, Customer Relationship Survey, 1H2014, - Top Supervisor Team Net Promoter Score of 87% 2H2014 Professional experience continued, Novella Walton Phone: 404-556-7261, Email: Novella.Walton@VerizonWireless.com, Page 2 of, 2 Lead and direct forward thinking Global, Enterprise Advisor team in servicing fortune 100 customers., Assisting Sales to renew existing contracts, introducing new services via migrations., Strong 2Q Leadership Net Promoter Score improvement, from 69% to 100%, June and July Manage and provide sales and services for 15, key enterprise contracts representing an $8-10 million revenue base., Supervisor Account, 05/2011, to, 09/2013, Company Name, Provide support to internal and external customers through equipment order processing and account maintenance transactions for National,, Major, and SMB Accounts., Partnering with the Business Sales Channel to service our customers, assist with escalations, and handle large research requests as required., The focus is to complete all requests sent through Workflow Manager with accuracy and in a timely manner ensuring commitment times to, our customers are maintained., This role will provide online support as needed and will answer all account, equipment ordering, and My BIZ/VEC related questions., National Account Business Service Center Supervisor, 03/2005, to, 05/2011, Company Name, City, ,, State, Responsible for working with peers to provide alternative to successfully increase quality and productivity measures., Implemented strategies to reduce churn to <>, Offer alternatives scripting to increase customer satisfaction and net promoter scores., Interface with training to identify training needs and assign to SMEs (subject matter experts)., Monitor and track phone team's performance through intraday reporting and systems., Evaluate individual performance through daily interactions, audits, monitoring and feedback., Education and TrainingBachelor of Arts, :, Communications, 1984, Mercer University, City, ,, State, Communications, Skills, Account Management, Process Improvement, Sales, Additional Information, Awards and Recognitions 2006 Top Team Award (August and October) Ranked, #1 of, 17 Supervisory Teams 2006 4th Quarter Leader, 2009 Winner's Circle Award (Alltel Migration) Projects Strategic Churn Reduction Team Center Champion for the release and, implementation of, OneSource S.E.L.F (Supervisor Enrichment Leadership Fundamentals) Alltel Migration Project NSA Account Team, Supervisor, June 2004 - Mar 2005 Consumer Support / CMA Supervisor",and TrainingBachelor of Arts
