Job_Role,Skills,Education
DESIGNER,"Desktop Publishing Software: Photoshop, Illustrator, Active Listening Skills, Advanced Problem-Solving, Great Organizational Skills, Confidence and Empathy, Interests, Art, Photography, Graphic Design, Writing, Reading, Volunteering, Languages, I am able to comfortably speak and write in English. I am also able to speak Spanish, but not as skilled in writing. I am currently in my 3rd year in, Spanish Classes, and I was given the opportunity to join the Spanish Honor Society at my school recently. And I can also speak Vietnamese on a, fluent level, but I am not able to write in Vietnamese., Accomplishments, Being offered the opportunity to create a graphic design piece for a school event, and having my artwork chosen for the visual., Meeting consistent deadlines with my work in all my classes, including Graphic Design which involves projects every week or so, and being, creative to create an original idea to be graded and possibly featured in art shows in the city., Taking part in many volunteering opportunities that span from school activities to outside events., Being chosen to take part in an IT Program at school, where I learn Graphic Design.Volunteering, Graphic Designer, April 2015, Company Name, ï¼​, City, ,, State, Another volunteering experience that I found to be quite important with my skills and classes that I take is being a graphic designer for a Walk, Event for my school. The opportunity for a graphic designer who would design a poster/flier for the Walk for Suicide event was open and I choose, to create a design and submit it for the chance to be featured. My responsibilities involved creating a design that would clearly express the beliefs, of the Walk for Suicide event, state information such as the event time and address, and to intrigue the eye and to create interest overall. The event, was something I believed to be very important so I took my time on creating the design which took a 2 days, with my ability to create and deliver, in a timely manner. My design was actually chosen and used on different social medias of the event and was an experience that I believe helped me, learn more about time management, deadlines, communication of information while doing something I enjoy., Cashier/Waiter/Greeter, March 2013, Company Name, ï¼​, City, ,, State, A volunteering experience that I took part in was a Dog Fair back in 2013, it was an opportunity for people to come into the fair and find dogs, that they wanted to adopt and also a chance for dog owners to come in with their dogs and participate in Dog races, raffles, and purchase many, other dog related things in support of the Dog adoption agency to care for the other dogs that had currently not been adopted yet. My first, volunteer job there was a greeter for everyone who had entered the fair, I was to record who came into the park, asking for any donations, and if, they wanted to participate in the races or raffles. As the fair days progressed and my skills had shown to improve around the fair goers, I was, upgraded to a waiter at many of the stands that were around to sell food. I up-sold the menu items, and beverages to increase the profits that, would go towards donations for the dogs. I took the necessary steps to meet customer needs and to resolve any food or service issues. I was able, to record the orders, repeat them back in a clear, understandable manner and communicated with the other volunteers. I rotated around, taking on, the responsibilities of a cashier, waiter, and greeter to provide the highest service I could give., Work History, Animal Caretaker, June 2014, to, Current, City, ,, State, Family Babysitter, May 2013, to, May 2015, City, ,",High School Diploma
FITNESS,"Have experience working on multiple different POS systems, Microsoft, Excel and other organization sites used for scheduling. Â Also, very, experienced with G-Drive and all its applications. Â, I am a quick and efficient problem solver when hit with an issue whether it being working, under a short time frame or scheduling and unexpected issues that arise. Â, Managing and communicating with others, not only staff members with, information but also leading a team on a regular basis. Â, High and motivating energy when working with others but able to adjust is to an, appropriate level., Accomplishments, Finishing Ironman Arizona (140.6 Miles)- Not work related but trained roughly 20 hours a week while upholding great performance at work. It, required excellent time management skills, relentless drive and motivation from within., Adventure Run Coordinator-Hosted free community monthly runs ranging from 250 to 550 (two different locations), motivated them and marketed, the event to increase by 12% over two years with 30% of the participants being brand new. Also, managed and communicated with staff and, volunteers details and tasks throughout event., Girls on the Run Coach Fall/Spring of 2013- Leading and teaching young girls life skills through running (30 girls at age of 9-11), Team in Training Captain Spring 2012- Motivating other runners and walkers on the team as they trained and reached their goal of running a, marathon, via in person, email and while out running. (12 participants), Work Experience, Adventure Run Coordinator, January 2014, to, Current, Company Name, ï¼​, City, ,, State, Adventure Run is a free monthly fun run produced and owned by Road Runner Sports.Â  I am the coordinator for two of them, (the two available, in Arizona).Â  The duties and commitments are at large variety.Â  As a representative and coordinator for the program, I am in charge of, permitting for the event and charity beer garden, some levels of sponsorship and vendors.Â  Securing local vendors and sponsors as well as, locations for post run celebrations.Â  Along with these responsibilities, I am in charge of setup and tear down.Â  I am on the mic during the event, of about 500 people, manage up to 25 volunteers at a time during the event and effectively schedule them, and communicate details and important, facts with the staff.Â  Other additional responsibilities are promoting the event to the surrounding running and fitness community.Â  I am required to, be time efficient, extremely organized and prepped along with the ability to be flexible and overcome unexpected obstacles such as weather, changes, cancellations, people running late and being short staffed all while remaining calm and high energetic.Â Â, Grassroots Marketing Representative, May 2013, to, Current, Company Name, ï¼​, City, ,, State, As a Grassroots Marketing Representative I have a mixture of duties and responsibilities.Â  I am the community outlet for both Arizona stores and, am in charge of booking group runs, clinics for local teams and packet pick ups for races.Â  I reach out to local gyms and community vendors,, charity partners that could have potential partnerships with Road Runner Sports and figure out the best fit for both parties.Â  I also am in charge of, managing my own schedule and both Arizona's stores event calendars as well as a budget for the store's events.Â Â, Cash Wrap, October 2011, to, May 2013, Company Name, ï¼​, City, ,, State, Help customers, new runners and old, find the best items to fit their needs.Â  Also, make recommendations and answer any questions in regards to, the customer's running.Â  Multitask while checking customers out, answering phone questions and in person., Â, Operations, January 2011, to, September 2012, Company Name, ï¼​, City, ,, State, Greet and check all members of gym in after opening up the facility alone.Â  I also answer all incoming calls and either help assist with their, concerns and questions or direct them to another associate.Â  I sign in and ring up guests, make appointments for a variety of services and cancel,, and renew memberships.Â  This requires me to be very successful at multitasking and a leader.Â  I must always be on time and have a positive, upbeat attitude and always am required to think of the customer first.Â  As it being a company that portrays healthy lifestyles, as an employee of, the company are preferred to maintain one as well through physical activity at the facility, thus I am knowledgeable and passionate about it as, well.Â  As well as work 8 hours a week in the childcare with children from the age of 3 months to 12 years old., Front Desk Fitness Attendant, April 2006, to, January 2011, Company Name, ï¼​, City, ,, StateDuring the Summer Kid's Camp I work as an Advisor where I plan daily team and individual activities, help with lunch process and swim sessions,, oversee the children's participation and interact with them.Â, As a Sports Club team member, I make promotional calls for the member sales, department, monitor nursery, and monitor pool.Â  In July, I work the DSL Swim Championships where I am required to support facility needs for, each team; direct spectators to appropriate areas, maintain a clean, safe event site, and answer general questions.Â  Working with people one-on-, one and the general public is second nature in this environment as I consistently address different questions and problems regularly., As an, attendant, I work the front desk of the fitness center and monitor member's use of gym.Â  Other duties include:Â  Keeping equipment and fitness/, weight room, and towels clean and orderly, assist members with other questions that are frequently asked; make smoothies, work snack bar,",and Training
DESIGNER,"arts, blueprint reading, bridges, Computer experience, direction, documentation, Edit, Engineer, English, French, German, government, Graphic,, materials, Access, Excel, Microsoft Office, PowerPoint, Word, posters, processes, read, research, Spanish, welding, Additional Information, 210A 76th street, 07047 Dear Ms. Gina Lucia The adds you have posted on your website mactches my qualifications in graphic art. I haveremarkable skills in digital, and graphic arts, and I would make a great designer in, and out of the field. I've had much experience with, graphic, and digital art in High School, and posted my artwork on my website. This skill has taught me many things about creativity. When I, make art in any design I notice that I am creating life on a blank piece of paper. To me making art is bringing the creativity to life, and to also, give it any kind of emotions to it. I have worked with many people who had more experience then me, and have already started to work, under you. If you speak to them they can tell you more about my designs. I am a hard worker, and I will always do my best to get the job, done. I hope this has given you the thought of allowing me to work under you. Hopefully we will have a chance to speak in person next",in psychology has allowed me to learn the nuances of people and has provided me with good investigative and analytical skills that will suit your
INFORMATION-TECHNOLOGY,"COMMUNICATION, Collaborating with clients and fostering a positive business relationship to meet all levels of IT service demands (Technical, R&D and, operations and maintenance), Clearly discussing and conveying Information Technology concepts and terminology with both technical and non-technical staff at all levels, within and outside the Department, Producing clear and concise written documents, emails, project status reports and briefs, Communicating effectively with various levels of the organization, Expertise, Making strategic judgments and evaluating the impact, Cloud Environments Design & Implementation, Network Design & Implementation VOIP, Cyber Security (NIST HITRUST/HIPAA), Project Management, Technical Support Management, Budget Management, Developing and responding to Request for Proposals, Current with Emerging Technologies, Experience, Director of Information technology, Sep 2005, to, Current, Company Name, ï¼​, City, ,, State, At Adsystech I am one of three employees that have a key man insurance policy against them., This in of itself, speaks to the trust and value I provide the organization., I was hired to design, and deploy the first data center the company owned in its efforts to deploy a new offering, an enterprise Software as a, Service (SaaS) product., I was initially an employee of an Adsystech customer working with the Adsystech EVP on an enterprise County Wide project and posed, the idea that they should move from ""selling"" software to ""renting"" it via an up and coming model SaaS., Today, everyone is using SaaS products and paying monthly for various products but in 2004 (when I initially made the proposal) it was an, exciting and new potential market which I leveraged to increase the returns at Adsystech and most importantly, generate new recurring, revenue., I was hired in 05' to put in place all things SaaS, this included designing a data center from the ground up, creating cyber security policies, and controls, putting together a team to support the data center as well as a team to provide technical support for the new product offering., As an early adopter, in 2008 I designed and deployed a hybrid cloud environment in our data center., Again in 08' this was a new technology but my decision demonstrates foresight in emerging technologies and understand in the value of, leveraging technology to become more efficient and financial prudent., I'm very proud of the work I've done and Adsystech, below are some key areas in my control: Network Design Monitoring and, Maintenance Cloud Technologies Cyber Security (NITS, CIS, HITRUST/HIPAA) Project Management Technical Support Management, Staff Professional Development RFP Responses., Information technology Manager, Sep 2003, to, Sep 2005, Company Name, ï¼​, City, ,, State, City organization responsible for managing +120 Million dollars for support of County Wide Human Service programs., I was hired as Project Manager and was quickly promoted to the Information Technology Manger., As PM I identified, evaluated and lead a bi-County steering committee in all technical aspect in an RFP release and selection process., After promotion I continued to server as the project manager for the 2.5 million dollar system rollout which ranged from gathering the, business requirements for the design and deployment to creating the processes and managing the team to for the roll out to ~2000 users, across Los Angeles County., In this capacity I managed a project support team including administrators, help desk staff and trainers., As the IT Manager, I supervised network administrators and was responsible for all high level network design and architecture for the, organization., I evaluated the security risks, ensuring HITECH/HIPAA protocol were followed., Below are some key areas in my control: Network Design and Oversight Project Management Product Training and Support., Information technology Manager, Sep 1998, to, Mar 2003, Company Name, ï¼​, City, ,, State, At Relax the Back I was responsible for the overall management, infrastructure and strategic planning of our National point of sale networkat 100+ retail locations and 5 distribution centers., I managed the ERP solution at our manufacturing plant in Boston and our accounting and HR systems at the corporate office., Nine short months after starting with the company, I was promoted to IT Manage., I acted as liaison between vendors, operation staff and the CFO for all major projects on time and on budget., Cisco Routers/ Firewalls., Windows Server Management., Desktop Support., Education and Training, M.S, ,, IT, CSUF, IT, Fullerton Masters of Science Degree, ,, Information Technology, Mihaylo College of Business and Economics, California State University, Information Technology GPA: 3.4, B.S, ,, IT, UOP, IT, Bachelors of Science Degree, ,, Information Technology, University of Phoenix, Information Technology GPA: 3.7, Skills, accounting, Budget Management, budget, bi, Cisco Routers, concise, clients, designing, ERP, financial, Firewalls, help desk, HR, Information, Technology, insurance, managing, market, office, 2000, enterprise, network design and architecture, Network Design, Network Design &, Implementation, network, policies, processes, Producing, Project Management, promotion I, Proposals, proposal, retail, RFP, selling, software",and Training
ARTS,"Superior communication skills, Staff training and development, Fluent in Spanish, Dependable and reliable, Excellent multi-tasker, Inventory management, Sales expertise, Accurate money handling, Team player mentality, Outgoing personality, Documentation familiarity, Verbal/written communication, Active listening, Cash handling accuracy, Detail-oriented, Cheerful and energetic, Flexible scheduling, Superior organization skills, Superior communication skills, Staff training and development, Fluent in Spanish, Dependable and reliable, Excellent multi-tasker, Flexible schedule, Accomplishments, When I first started to work for Boost Mobile I didn't know a thing about sales or phones at all. I was so insecure about everything, until one day I, decided to put all the petty thoughts aside and show my true strength and confidence. My sale skills went from zero to none to one hundred. My, best day is when I sold 31 phones in one day with accessories, I was so proud about how hard I work to get to my goal. I have a lot of thanks to, my coworkers because they showed me how to push myself to my highest limit and conquer my goals. They also showed me how to be a team, player and to always help everyone and not just customers. One of the best months I had was when I sold 199 phones and over, $3,088 worth in, accessories. Routinely helped as many as ten customers each day in a high-volume retail outlet. Fulfilled all supervisory duties when Store Manager, was on vacation. I'm very proud on what I've learn over the couple of months working at Boost Mobile of Mobile Factory, I thank them for, helping me develop my skills and making me into the person I am today., Experience, Company Name, March 2015, to, November 2015, Sale Consultant, City, ,, State, I Answered customers' questions and addressed problems and complaints in person and through the phone. I also helped customers select, products that best fit their personal needs, and processed an average of 80 transactions each day in a timely manner. Maintained visually appealing, and effective displays for the entire store. Educated customers on product and service offerings. Completed purchases with cash, credit and debit, payment methods. Trained all new sales employees on effective techniques. Organized items in visually appealing manner. And Inventory checks, throughout the day., Company Name, October 2014, to, December 2014, Cashier, City, ,, State, Working at Michael's Arts&Crafts my job was really simple and enjoying. My responsibilities were to assist customers with their needs, handle, money throughout the day and give change back. Also with the seasonal position I had their I did learn a lot on how to greet customers and how to, make sure that they were satisfied. I Completed purchases with cash, credit and debit payment methods. And Organized items in visually appealing, manner., Company Name, February 2014, to, June 2014, Front clerk City, ,, State, Accepted payment from customers and made change as necessary.Cleaned up spilled food, drink and broken dishes, and removed empty bottles, and trash. Take cake orders over the phone., Education, Northwood High School, 2014, High School Diploma, :, History, City, ,, State, ,, United states, During my four years of high school I did struggle to manage my grade but with the right push and motivation, I was able to achieve my goal. I, managed to get all A's, B's and C's., Work History, Company Name, March 2015, to, November 2015, Sales Consultant, City, ,, State, Company Name, October 2014, to, December 2014, Seasonal Cashier, City, ,, State, Company Name, February 2014, to, June 2014, Food Clerk, City, ,, State, Skills, Fast paced worker, Attention to detail, Customer service, Fluent in Spanish, Communication and verbal skills",Northwood High School
